[
  {
    "schemeCode": "PM-KISAN",
    "name": "Pradhan Mantri Kisan Samman Nidhi",
    "shortName": "PM-KISAN",
    "level": "central",
    "state": "All India",
    "implementingDepartment": "Agriculture, Cooperation & Farmers’ Welfare, Ministry of Agriculture & Farmers Welfare",
    "category": "financial",
    "description": "Income support for eligible landholding farmer families, subject to scheme exclusions.",
    "eligibility": {
      "logic": "AND",
      "conditions": [
        {
          "fieldName": "farmer_type",
          "operator": "equals",
          "expectedValue": "farmer",
          "criterion": "Applicant must be a farmer",
          "remediation": "Verify farmer status with the implementing authority."
        },
        {
          "fieldName": "land_size_hectares",
          "operator": "exists",
          "criterion": "Cultivable landholding information must be available",
          "remediation": "Add or verify landholding information."
        }
      ]
    },
    "exclusions": {
      "logic": "OR",
      "conditions": [
        {
          "fieldName": "pmkisan_institutional_landholder",
          "fieldSource": "extra_attributes",
          "operator": "equals",
          "expectedValue": true,
          "criterion": "Applicant must not be an institutional land holder"
        },
        {
          "fieldName": "pmkisan_constitutional_post_holder",
          "fieldSource": "extra_attributes",
          "operator": "equals",
          "expectedValue": true,
          "criterion": "Applicant must not be a former/current constitutional post holder"
        },
        {
          "fieldName": "pmkisan_political_office_holder",
          "fieldSource": "extra_attributes",
          "operator": "equals",
          "expectedValue": true,
          "criterion": "Applicant must not fall within the specified former/current political office exclusions"
        },
        {
          "fieldName": "pmkisan_government_employee_excluded",
          "fieldSource": "extra_attributes",
          "operator": "equals",
          "expectedValue": true,
          "criterion": "Applicant must not fall within the specified government/public-body employee exclusion"
        },
        {
          "fieldName": "pmkisan_pension_10000_plus",
          "fieldSource": "extra_attributes",
          "operator": "equals",
          "expectedValue": true,
          "criterion": "Applicant must not be a specified superannuated pensioner receiving ₹10,000 or more per month"
        },
        {
          "fieldName": "pmkisan_income_tax_payer",
          "fieldSource": "extra_attributes",
          "operator": "equals",
          "expectedValue": true,
          "criterion": "Applicant must not have been an income-tax payer in the last assessment year"
        },
        {
          "fieldName": "pmkisan_registered_professional",
          "fieldSource": "extra_attributes",
          "operator": "equals",
          "expectedValue": true,
          "criterion": "Applicant must not be a practicing registered professional covered by the exclusion"
        }
      ]
    },
    "benefits": [
      "₹6,000 per year in three instalments of ₹2,000, subject to eligibility and exclusions."
    ],
    "benefitLimits": [
      {
        "benefitType": "fixed_amount",
        "fixedAmount": 6000,
        "basis": "annual support",
        "description": "₹6,000 per year in three instalments."
      }
    ],
    "coverageConditions": [],
    "documents": [
      {
        "name": "Aadhaar",
        "requiredType": "required",
        "purpose": "Identity verification"
      },
      {
        "name": "Landholding papers",
        "requiredType": "required",
        "purpose": "Landholding verification"
      },
      {
        "name": "Savings bank account details",
        "requiredType": "required",
        "purpose": "Benefit transfer"
      }
    ],
    "actionSteps": [
      {
        "step": 1,
        "title": "Check registration/status",
        "description": "Check registration or beneficiary status on the official PM-KISAN portal.",
        "responsibleParty": "Farmer",
        "mode": "online",
        "dependency": null,
        "source": "Official PM-KISAN scheme information"
      },
      {
        "step": 2,
        "title": "Complete required process",
        "description": "Complete the applicable registration/application process through the prescribed channel.",
        "responsibleParty": "Farmer/implementing channel",
        "mode": "either",
        "dependency": "Step 1",
        "source": "Official PM-KISAN scheme information"
      }
    ],
    "applicationChannels": [
      "Online",
      "CSC"
    ],
    "officialPortals": [
      "https://pmkisan.gov.in/"
    ],
    "sources": [
      {
        "title": "Official PM-KISAN scheme information",
        "sourceType": "official",
        "url": "https://pmkisan.gov.in/"
      }
    ],
    "targetingNotes": [],
    "allocationPolicy": [],
    "geographicTargeting": [
      "All India"
    ],
    "procurementConditions": [],
    "rawSourceText": [],
    "lastVerifiedAt": null,
    "status": "active",
    "translations": {
      "hi": {
        "name": "प्रधानमंत्री किसान सम्मान निधि",
        "description": "पात्र भूमिधारक किसान परिवारों के लिए प्रत्यक्ष आय सहायता योजना।",
        "category": "वित्तीय सहायता"
      },
      "hinglish": {
        "name": "Pradhan Mantri Kisan Samman Nidhi",
        "description": "Eligible landholding farmer families ke liye direct income support scheme.",
        "category": "Financial Support"
      }
    }
  },
  {
    "schemeCode": "PMFBY",
    "name": "Pradhan Mantri Fasal Bima Yojana",
    "shortName": "PMFBY",
    "level": "central",
    "state": "All India",
    "implementingDepartment": "Ministry of Agriculture & Farmers Welfare",
    "category": "crop_insurance",
    "description": "Crop insurance support for notified crops and areas subject to applicable conditions and timelines.",
    "eligibility": {
      "logic": "AND",
      "conditions": [
        {
          "fieldName": "farmer_type",
          "operator": "in",
          "expectedValue": [
            "farmer",
            "tenant_farmer",
            "sharecropper"
          ],
          "criterion": "Applicant must be a farmer, tenant farmer, or sharecropper covered by the scheme",
          "remediation": "Verify farmer/tenancy status and insurable interest."
        },
        {
          "fieldName": "primary_crop",
          "operator": "exists",
          "criterion": "The crop to be insured must be identified",
          "remediation": "Provide the crop to be insured."
        },
        {
          "fieldName": "pmfby_insurable_interest",
          "fieldSource": "extra_attributes",
          "operator": "equals",
          "expectedValue": true,
          "criterion": "Applicant must have an insurable interest in the crop/land",
          "remediation": "Provide or verify the applicable ownership/tenure evidence."
        },
        {
          "fieldName": "pmfby_notified_crop_area",
          "fieldSource": "extra_attributes",
          "operator": "equals",
          "expectedValue": true,
          "criterion": "The crop and area must be notified for insurance",
          "remediation": "Verify notification for the crop and area before applying."
        },
        {
          "fieldName": "pmfby_within_deadline",
          "fieldSource": "extra_attributes",
          "operator": "equals",
          "expectedValue": true,
          "criterion": "Application must be within the prescribed timeframe",
          "remediation": "Confirm the applicable enrollment deadline."
        }
      ]
    },
    "exclusions": {
      "logic": "OR",
      "conditions": [
        {
          "fieldName": "pmfby_duplicate_compensation",
          "fieldSource": "extra_attributes",
          "operator": "equals",
          "expectedValue": true,
          "criterion": "Duplicate compensation must not be claimed for the same covered loss"
        }
      ]
    },
    "benefits": [
      "Farmer premium is capped at 2% for Kharif food/oilseed crops, 1.5% for Rabi food/oilseed crops and 5% for annual commercial/horticultural crops, subject to applicable rules.",
      "Coverage may include standing crop, prevented sowing, prescribed post-harvest losses and localized calamities subject to applicable notification and conditions."
    ],
    "benefitLimits": [
      {
        "benefitType": "descriptive",
        "basis": "farmer premium rate",
        "description": "Maximum farmer premium rates are 2% Kharif food/oilseed, 1.5% Rabi food/oilseed, and 5% annual commercial/horticultural crops."
      }
    ],
    "coverageConditions": [
      "Notified crop and area",
      "Prescribed enrollment timeframe",
      "Applicable insured risks and conditions"
    ],
    "documents": [
      {
        "name": "Photograph",
        "requiredType": "required",
        "purpose": "Application/identity record"
      },
      {
        "name": "Passbook",
        "requiredType": "required",
        "purpose": "Bank/account verification"
      },
      {
        "name": "Identity and address proof",
        "requiredType": "required",
        "purpose": "Identity verification"
      },
      {
        "name": "Land/tenure documents",
        "requiredType": "required",
        "purpose": "Insurable interest/tenure verification"
      },
      {
        "name": "Crop declaration",
        "requiredType": "required",
        "purpose": "Crop and insurance details"
      }
    ],
    "actionSteps": [
      {
        "step": 1,
        "title": "Confirm notification",
        "description": "Confirm that the crop and area are notified for the relevant season.",
        "responsibleParty": "Farmer/implementing channel",
        "mode": "either",
        "dependency": null,
        "source": "Official PMFBY scheme information"
      },
      {
        "step": 2,